Original filename,Shopify Files filename,Description
logo-mark.png,mytoywagon-logo-mark.png,Mytoywagon logo mark
logo-primary.png,mytoywagon-logo-primary.png,Mytoywagon logo primary
logo-primary-dark.png,mytoywagon-logo-primary-dark.png,Mytoywagon logo primary dark
logo-wordmark.png,mytoywagon-logo-wordmark.png,Mytoywagon logo wordmark
hero-kaleidoscope.webp,hero-amber-kaleidoscope.webp,Hero amber kaleidoscope
bear-unwrapping.png,hero-bear-unwrapping-tissue.png,Hero bear unwrapping tissue
bear-unwrapping-portrait.png,hero-bear-unwrapping-portrait.png,Hero bear unwrapping portrait
our-story-banner.png,ourstory-banner-bear-thanknote.png,Ourstory banner bear thanknote
our-story-hero.png,ourstory-hero-children-playing.png,Ourstory hero children playing
our-story.png,ourstory-irfana-rashid.png,Ourstory irfana rashid
rewards-hero.png,hero-rewards-stacked-gifts.png,Hero rewards stacked gifts
hafsa-and-noor.webp,founders-hafsa-noor-with-playmat.webp,Founders hafsa noor with playmat
trust-shipping.png,trust-strip-shipping-wagon.png,Trust strip shipping wagon
trust-shipping-mark.png,trust-strip-shipping-wagon-mark.png,Trust strip shipping wagon mark
trust-returns.png,trust-strip-returns-wax-seal.png,Trust strip returns wax seal
trust-returns-mark.png,trust-strip-returns-mark.png,Trust strip returns mark
trust-packed.png,trust-strip-packed-gift-box.png,Trust strip packed gift box
trust-packed-mark.png,trust-strip-packed-mark.png,Trust strip packed mark
trust-rewards.png,trust-strip-rewards-chalkboard.png,Trust strip rewards chalkboard
trust-rewards-mark.png,trust-strip-rewards-mark.png,Trust strip rewards mark
cat-animals.webp,category-wooden-animals-bumbu-fawn.webp,Category wooden animals bumbu fawn
cat-fairy-house.webp,category-fairy-house-purple-flower.webp,Category fairy house purple flower
cat-felt-florals.png,category-felt-florals.png,Category felt florals
cat-felt-mats-farm.webp,category-felt-mats-farm-playscape.webp,Category felt mats farm playscape
cat-kitchen-felt-veg.png,category-kitchen-play-felt-vegetables.png,Category kitchen play felt vegetables
cat-nature.webp,category-nature-play-specimen-jars.webp,Category nature play specimen jars
cat-nature.png,category-nature-play-specimen-jars-v2.png,Category nature play specimen jars v2
cat-rideons-baghera.png,category-rideons-baghera-fireman.png,Category rideons baghera fireman
cat-rideons-speedster.webp,category-rideons-baghera-speedster.webp,Category rideons baghera speedster
cat-sensory.webp,category-sensory-busy-bee-mirror.webp,Category sensory busy bee mirror
cat-sensory.jpg,category-sensory-mushroom-scoop.jpg,Category sensory mushroom scoop
cat-sensory-rockpool.png,category-sensory-rockpool-tray.png,Category sensory rockpool tray
age-first-year.webp,age-first-year-haba-fish-rattle.webp,Age first year haba fish rattle
age-toddler.webp,age-toddler-sabo-alphabet-blocks.webp,Age toddler sabo alphabet blocks
age-preschool.webp,age-preschool-sisters-building-blocks.webp,Age preschool sisters building blocks
age-early-school.webp,age-early-school-magnetic-tiles.webp,Age early school magnetic tiles
age-early-school.jpg,age-early-school-bauspiel-lucent-pillars.jpg,Age early school bauspiel lucent pillars
age-early-school.png,age-early-school-light-table.png,Age early school light table
age-early-school-fagus.webp,age-early-school-fagus-firetruck.webp,Age early school fagus firetruck
age-school.webp,age-school-girls-huckleberry-magnifier.webp,Age school girls huckleberry magnifier
age-school-drewart-camper.png,age-school-drewart-camper.png,Age school drewart camper
new-bumbu-spring-flowers.webp,product-bumbu-wooden-spring-flowers.webp,Product bumbu wooden spring flowers
new-coralwhim-cove.webp,product-gus-mabel-coralwhim-cove-felt-playmat.webp,Product gus mabel coralwhim cove felt playmat
new-fairy-streamlet.webp,product-gus-mabel-fairy-streamlet-playmat.webp,Product gus mabel fairy streamlet playmat
new-ganapati-finger-puppets.webp,product-ganapati-wool-finger-puppets-12.webp,Product ganapati wool finger puppets 12
new-mushie-rainbow-maze.webp,product-mushie-wooden-magnetic-rainbow-maze.webp,Product mushie wooden magnetic rainbow maze
new-tender-leaf-gnomes.webp,product-tender-leaf-woodland-gnome-family.webp,Product tender leaf woodland gnome family
new-tiny-fox-hole-birthday-ring.jpg,product-tiny-fox-hole-wooden-birthday-ring-PREORDER.jpg,Product tiny fox hole wooden birthday ring PREORDER
tender-leaf-forest-floor.webp,product-tender-leaf-my-forest-floor.webp,Product tender leaf my forest floor
best-bauspiel-color-track.png,product-bauspiel-color-track-with-gems.png,Product bauspiel color track with gems
best-bauspiel-color-track-45.webp,product-bauspiel-color-track-45-piece-set.webp,Product bauspiel color track 45 piece set
best-ingenious-insects.png,product-tara-treasures-ingenious-insects-puppet-book.png,Product tara treasures ingenious insects puppet book
best-pastel-gnomes.webp,product-wonderheart-pastel-wooden-gnomes-set-6.webp,Product wonderheart pastel wooden gnomes set 6
bauspiel-lucent-tower.png,product-bauspiel-lucent-cubes-tower.png,Product bauspiel lucent cubes tower
bauspiel-color-street.png,product-bauspiel-color-street.png,Product bauspiel color street
bauspiel-flower-sparkling-stones.webp,product-bauspiel-flower-sparkling-stones-60-set.webp,Product bauspiel flower sparkling stones 60 set
gift-leaf-cup.webp,product-wild-mountain-child-leaf-cup.webp,Product wild mountain child leaf cup
gift-felt-donuts.webp,product-tara-treasures-felt-donuts-set-4.webp,Product tara treasures felt donuts set 4
gift-caterpillar-babies.webp,product-fairyshadow-little-critter-hedge-cozy.webp,Product fairyshadow little critter hedge cozy
gift-kaleidoscope.webp,product-amber-kaleidoscope-blue-dreams.webp,Product amber kaleidoscope blue dreams
gift-card-floral.png,product-gift-card-embroidered-floral.png,Product gift card embroidered floral
gift-card.webp,product-gift-card.webp,Product gift card
heirloom-butterfly-wings.jpg,product-jack-be-nimble-monarch-butterfly-wings.jpg,Product jack be nimble monarch butterfly wings
heirloom-bumbu-green-oak.webp,product-bumbu-large-green-oak-tree.webp,Product bumbu large green oak tree
heirloom-drewart-camper.png,product-drewart-wooden-camper-van-natural.png,Product drewart wooden camper van natural
heirloom-fagus-semi.webp,product-fagus-wooden-semi-truck-trailer.webp,Product fagus wooden semi truck trailer
heirloom-five-monkeys.webp,product-tara-treasures-five-little-monkeys.webp,Product tara treasures five little monkeys
drewart-camper.webp,product-drewart-wooden-camper-alt.webp,Product drewart wooden camper alt
drewart-dollhouse-girl.webp,product-drewart-wooden-dollhouse-lifestyle.webp,Product drewart wooden dollhouse lifestyle
brand-drewart-cupboard.webp,brand-drewart-kitchen-cupboard.webp,Brand drewart kitchen cupboard
baghera-speedster.webp,product-baghera-speedster-dark-red.webp,Product baghera speedster dark red
review-drewart-dollhouse.webp,review-drewart-dollhouse-girl.webp,Review drewart dollhouse girl
review-haba-eggs.webp,product-haba-wooden-musical-eggs-set-5.webp,Product haba wooden musical eggs set 5
review-toverlux.jpg,product-toverlux-magic-wooden-lamp.jpg,Product toverlux magic wooden lamp
bumbu-acorn.png,product-bumbu-enchanted-treehouse.png,Product bumbu enchanted treehouse
bumbu-workshop.mp4,video-bumbu-workshop-romania.mp4,Video bumbu workshop romania
blog-bumbu-treehouse.jpg,blog-hero-bumbu-enchanted-treehouse.jpg,Blog hero bumbu enchanted treehouse
tara-farm-animals.webp,product-tara-treasures-felt-farm-animals-set-10.webp,Product tara treasures felt farm animals set 10
tara-founders-nepal.webp,brand-tara-treasures-founders-jag-jooli-nepal.webp,Brand tara treasures founders jag jooli nepal
tara-felt-flowers-child.webp,product-tara-treasures-felt-flowers-child.webp,Product tara treasures felt flowers child
tara-bear-hunt-playmat.webp,product-tara-treasures-bear-hunt-playmat.webp,Product tara treasures bear hunt playmat
tara-garden-planter-box.webp,product-tara-treasures-felt-garden-planter-box.webp,Product tara treasures felt garden planter box
tara-gnomes.png,product-tara-treasures-wooden-forest-gnomes.png,Product tara treasures wooden forest gnomes
tara-moon-crater-child-2.webp,lifestyle-tara-treasures-moon-crater-child-1.webp,Lifestyle tara treasures moon crater child 1
tara-moon-crater-child-8.webp,lifestyle-tara-treasures-moon-crater-child-2.webp,Lifestyle tara treasures moon crater child 2
tara-room-on-broom.webp,product-tara-treasures-room-on-broom-puppets-book.webp,Product tara treasures room on broom puppets book
tara-safari-playmat-child.webp,product-tara-treasures-safari-playset-child.webp,Product tara treasures safari playset child
tara-sea-rockpool-playscape.webp,product-tara-treasures-large-sea-rockpool-playmat.webp,Product tara treasures large sea rockpool playmat
tara-three-little-pigs.webp,product-tara-treasures-three-little-pigs-puppets.webp,Product tara treasures three little pigs puppets
brand-tara-lollipops.png,brand-tara-treasures-felt-lollipops.png,Brand tara treasures felt lollipops
garden-of-the-moon.webp,product-tara-treasures-garden-of-the-moon-playscape.webp,Product tara treasures garden of the moon playscape
gus-mabel-bee-tray.webp,product-gus-mabel-busy-bee-tray.webp,Product gus mabel busy bee tray
brand-gus-mabel-fairy.webp,brand-gus-mabel-fairy-scene.webp,Brand gus mabel fairy scene
brand-bauspiel-color-track.webp,brand-tile-bauspiel-color-track.webp,Brand tile bauspiel color track
brand-bauspiel-optical.png,brand-tile-bauspiel-optical-blocks.png,Brand tile bauspiel optical blocks
brand-fairyshadow.webp,brand-tile-fairyshadow.webp,Brand tile fairyshadow
papoose-forest-caves.png,brand-tile-papoose-forest-caves.png,Brand tile papoose forest caves
papoose-hot-drinks.webp,product-papoose-hot-drinks-set.webp,Product papoose hot drinks set
wild-mountain-child-cup.jpg,brand-tile-wild-mountain-child-cup.jpg,Brand tile wild mountain child cup
product-caterpillar-babies.webp,product-fairyshadow-caterpillar-babies-3.webp,Product fairyshadow caterpillar babies 3
felt-flowers.png,product-felt-tulip-flower.png,Product felt tulip flower
wagon-flowers.png,decorative-wagon-flowers.png,Decorative wagon flowers
specimen-jars.png,product-specimen-collecting-kit-june-december.png,Product specimen collecting kit june december
procurement-specimen-cabinet.webp,schools-cinematic-specimen-cabinet.webp,Schools cinematic specimen cabinet
brass-plate.png,decorative-brass-plate.png,Decorative brass plate
email-mothers-day.png,misc-mothers-day-email.png,Misc mothers day email
email-outside.png,misc-outside-email.png,Misc outside email
